{
  "domain": "illicit-fund-recovery",
  "version": 2,
  "sample_id": "record-009",
  "unit_of_account": "CNY-yuan",
  "actors": [
    { "id": "ACT-INV", "kind": "investigator", "org": "办案侦查机关" },
    { "id": "ACT-PRO", "kind": "prosecutor", "org": "审查起诉机关" },
    { "id": "ACT-JUD", "kind": "judge", "org": "审判机关" },
    { "id": "ACT-CUS", "kind": "custodian", "org": "涉案财物保管机构" },
    { "id": "ACT-FAM", "kind": "family", "org": "依法查询的相关当事人" }
  ],
  "holders": [
    { "id": "H-JIA", "kind": "person", "label": "请托人（化名甲）" },
    { "id": "H-YI", "kind": "person", "label": "中间人（化名乙）" },
    { "id": "H-BING", "kind": "person", "label": "收款人（化名丙）" },
    { "id": "H-POL", "kind": "authority", "label": "侦查机关扣押账户" },
    { "id": "H-TRE", "kind": "authority", "label": "国库" }
  ],
  "evidence": [
    { "id": "V-01", "kind": "transfer_voucher", "amount": 2000000, "issued_on": "2020-03-15", "summary": "甲向乙银行转账二百万元回单" },
    { "id": "V-02", "kind": "cash_estimate", "amount": 1000000, "issued_on": "2020-03-16", "summary": "甲向乙交付现金估算金额，经取款记录修正", "corrections": [
      { "date": "2020-04-02", "from_amount": 1200000, "to_amount": 1000000, "revision_id": "R-1" }
    ] },
    { "id": "V-03", "kind": "withdrawal_record", "amount": 1000000, "issued_on": "2020-03-14", "summary": "甲同期取现记录，用于修正现金估算" },
    { "id": "V-04", "kind": "transfer_voucher", "amount": 1600000, "issued_on": "2020-03-20", "summary": "乙向丙银行转账一百六十万元回单" },
    { "id": "V-05", "kind": "statement_record", "amount": 400000, "issued_on": "2020-03-21", "summary": "乙向丙交付现金四十万元，仅有言词记录" },
    { "id": "V-06", "kind": "transfer_voucher", "amount": 1000000, "issued_on": "2021-09-10", "summary": "丙向乙退回一百万元转账回单" },
    { "id": "V-07", "kind": "transfer_voucher", "amount": 600000, "issued_on": "2022-01-15", "summary": "乙向甲退回六十万元转账回单" },
    { "id": "V-08", "kind": "iou_document", "amount": 400000, "issued_on": "2022-02-01", "summary": "乙将截留四十万元包装为借款所立借条" },
    { "id": "V-09", "kind": "seizure_record", "amount": 1000000, "issued_on": "2023-06-01", "summary": "侦查机关对丙扣押一百万元决定书（转账线六十万元、现金线四十万元）" },
    { "id": "V-10", "kind": "seizure_record", "amount": 500000, "issued_on": "2023-06-02", "summary": "侦查机关对乙扣押五十万元决定书" },
    { "id": "V-11", "kind": "restitution_receipt", "amount": 1000000, "issued_on": "2024-03-10", "summary": "扣押款中一百万元退赔甲的收据" },
    { "id": "V-12", "kind": "forfeiture_order", "amount": 400000, "issued_on": "2024-03-10", "summary": "扣押款中四十万元上缴国库凭证" }
  ],
  "fund_batches": [
    { "id": "B-01", "amount": 2000000, "created_by": "E-01", "created_on": "2020-03-15", "delivery": "transfer", "certainty": "evidenced" },
    { "id": "B-02", "amount": 1000000, "created_by": "E-02", "created_on": "2020-03-16", "delivery": "cash", "certainty": "evidenced" },
    { "id": "B-03", "amount": 1600000, "created_by": "E-03", "created_on": "2020-03-20", "delivery": "transfer", "certainty": "evidenced" },
    { "id": "B-16", "amount": 400000, "created_by": "E-03", "created_on": "2020-03-20", "delivery": "cash", "certainty": "derived" },
    { "id": "B-04", "amount": 400000, "created_by": "E-04", "created_on": "2020-03-21", "delivery": "cash", "certainty": "claimed" },
    { "id": "B-05", "amount": 500000, "created_by": "E-05", "created_on": "2020-03-22", "delivery": "cash", "certainty": "derived" },
    { "id": "B-17", "amount": 500000, "created_by": "E-05", "created_on": "2020-03-22", "delivery": "cash", "certainty": "derived" },
    { "id": "B-06", "amount": 1000000, "created_by": "E-06", "created_on": "2021-09-10", "delivery": "transfer", "certainty": "evidenced" },
    { "id": "B-18", "amount": 600000, "created_by": "E-06", "created_on": "2021-09-10", "delivery": "transfer", "certainty": "evidenced" },
    { "id": "B-07", "amount": 600000, "created_by": "E-07", "created_on": "2022-01-15", "delivery": "transfer", "certainty": "evidenced" },
    { "id": "B-08", "amount": 400000, "created_by": "E-07", "created_on": "2022-01-15", "delivery": "cash", "certainty": "derived" },
    { "id": "B-09", "amount": 500000, "created_by": "E-08", "created_on": "2023-06-01", "delivery": "seizure", "certainty": "confirmed" },
    { "id": "B-10", "amount": 500000, "created_by": "E-08", "created_on": "2023-06-01", "delivery": "seizure", "certainty": "confirmed" },
    { "id": "B-11", "amount": 500000, "created_by": "E-09", "created_on": "2023-06-02", "delivery": "seizure", "certainty": "confirmed" },
    { "id": "B-12", "amount": 600000, "created_by": "E-10", "created_on": "2024-03-10", "delivery": "restitution", "certainty": "confirmed" },
    { "id": "B-13", "amount": 400000, "created_by": "E-10", "created_on": "2024-03-10", "delivery": "forfeiture", "certainty": "confirmed" },
    { "id": "B-14", "amount": 400000, "created_by": "E-11", "created_on": "2024-03-10", "delivery": "restitution", "certainty": "confirmed" },
    { "id": "B-15", "amount": 100000, "created_by": "E-11", "created_on": "2024-03-10", "delivery": "seizure", "certainty": "confirmed" }
  ],
  "events": [
    {
      "id": "E-01", "date": "2020-03-15", "kind": "deliver", "delivery": "transfer",
      "from_holder": "H-JIA", "to_holder": "H-YI",
      "inputs": [], "outputs": [{ "batch": "B-01", "amount": 2000000, "holder": "H-YI" }],
      "evidence": ["V-01"], "certainty": "evidenced",
      "note": "甲以找关系干预案件为名向乙转账二百万元"
    },
    {
      "id": "E-02", "date": "2020-03-16", "kind": "deliver", "delivery": "cash",
      "from_holder": "H-JIA", "to_holder": "H-YI",
      "inputs": [], "outputs": [{ "batch": "B-02", "amount": 1000000, "holder": "H-YI" }],
      "evidence": ["V-02", "V-03"], "certainty": "evidenced",
      "note": "甲向乙交付现金，估算一百二十万元经取现记录修正为一百万元"
    },
    {
      "id": "E-03", "date": "2020-03-20", "kind": "deliver", "delivery": "transfer",
      "from_holder": "H-YI", "to_holder": "H-BING",
      "inputs": [{ "batch": "B-01", "amount": 2000000 }],
      "outputs": [
        { "batch": "B-03", "amount": 1600000, "holder": "H-BING" },
        { "batch": "B-16", "amount": 400000, "holder": "H-YI" }
      ],
      "evidence": ["V-04"], "certainty": "evidenced",
      "note": "乙向丙转账一百六十万元，另四十万元留存备付现金"
    },
    {
      "id": "E-04", "date": "2020-03-21", "kind": "deliver", "delivery": "cash",
      "from_holder": "H-YI", "to_holder": "H-BING",
      "inputs": [{ "batch": "B-16", "amount": 400000 }],
      "outputs": [{ "batch": "B-04", "amount": 400000, "holder": "H-BING" }],
      "evidence": ["V-05"], "certainty": "claimed",
      "note": "乙向丙交付现金四十万元，仅有言词记录佐证，可认定程度低于转账"
    },
    {
      "id": "E-05", "date": "2020-03-22", "kind": "intercept", "delivery": "cash",
      "from_holder": "H-YI", "to_holder": "H-YI",
      "inputs": [{ "batch": "B-02", "amount": 1000000 }],
      "outputs": [
        { "batch": "B-05", "amount": 500000, "holder": "H-YI" },
        { "batch": "B-17", "amount": 500000, "holder": "H-YI" }
      ],
      "evidence": [], "certainty": "derived",
      "note": "乙截留现金一百万元，拆为两批以便后续分别扣押与追缴"
    },
    {
      "id": "E-06", "date": "2021-09-10", "kind": "return", "delivery": "transfer",
      "from_holder": "H-BING", "to_holder": "H-YI",
      "inputs": [{ "batch": "B-03", "amount": 1600000 }],
      "outputs": [
        { "batch": "B-06", "amount": 1000000, "holder": "H-YI" },
        { "batch": "B-18", "amount": 600000, "holder": "H-BING" }
      ],
      "evidence": ["V-06"], "certainty": "evidenced",
      "note": "请托事项未成，丙向乙退回一百万元，余六十万元仍在丙处"
    },
    {
      "id": "E-07", "date": "2022-01-15", "kind": "return", "delivery": "transfer",
      "from_holder": "H-YI", "to_holder": "H-JIA",
      "inputs": [{ "batch": "B-06", "amount": 1000000 }],
      "outputs": [
        { "batch": "B-07", "amount": 600000, "holder": "H-JIA" },
        { "batch": "B-08", "amount": 400000, "holder": "H-YI" }
      ],
      "evidence": ["V-07"], "certainty": "evidenced",
      "note": "乙向甲退回六十万元，截留四十万元并以借条包装为借款"
    },
    {
      "id": "E-08", "date": "2023-06-01", "kind": "seize", "delivery": "seizure",
      "from_holder": "H-BING", "to_holder": "H-POL",
      "inputs": [
        { "batch": "B-18", "amount": 600000 },
        { "batch": "B-04", "amount": 400000 }
      ],
      "outputs": [
        { "batch": "B-09", "amount": 500000, "holder": "H-POL" },
        { "batch": "B-10", "amount": 500000, "holder": "H-POL" }
      ],
      "evidence": ["V-09"], "certainty": "confirmed",
      "note": "侦查机关对丙扣押一百万元，合并转账线与现金线"
    },
    {
      "id": "E-09", "date": "2023-06-02", "kind": "seize", "delivery": "seizure",
      "from_holder": "H-YI", "to_holder": "H-POL",
      "inputs": [{ "batch": "B-17", "amount": 500000 }],
      "outputs": [{ "batch": "B-11", "amount": 500000, "holder": "H-POL" }],
      "evidence": ["V-10"], "certainty": "confirmed",
      "note": "侦查机关对乙截留款中的五十万元予以扣押"
    },
    {
      "id": "E-10", "date": "2024-03-10", "kind": "restitution", "delivery": "restitution",
      "from_holder": "H-POL", "to_holder": "H-JIA",
      "inputs": [
        { "batch": "B-09", "amount": 500000 },
        { "batch": "B-10", "amount": 500000 }
      ],
      "outputs": [
        { "batch": "B-12", "amount": 600000, "holder": "H-JIA" },
        { "batch": "B-13", "amount": 400000, "holder": "H-TRE" }
      ],
      "evidence": ["V-11", "V-12"], "certainty": "confirmed",
      "note": "判决执行（丙线扣押款一百万元）：六十万元退赔甲、四十万元上缴国库"
    },
    {
      "id": "E-11", "date": "2024-03-10", "kind": "restitution", "delivery": "restitution",
      "from_holder": "H-POL", "to_holder": "H-JIA",
      "inputs": [{ "batch": "B-11", "amount": 500000 }],
      "outputs": [
        { "batch": "B-14", "amount": 400000, "holder": "H-JIA" },
        { "batch": "B-15", "amount": 100000, "holder": "H-POL" }
      ],
      "evidence": ["V-11"], "certainty": "confirmed",
      "note": "判决执行（乙线扣押款五十万元）：四十万元退赔甲，余十万元仍在扣押账户待处置"
    }
  ],
  "claims": [
    {
      "id": "C-1", "asserter": "H-JIA", "nature": "请托报酬",
      "about": ["E-01", "E-02"], "evidence": ["V-01", "V-02"], "version": 1,